Capture UDP packets on droptlet server:
tcpdump -n udp port 50001

Output:
13:15:49.715341 IP 174.88.148.250.51117 > 159.203.18.181.50001: UDP, length 4
13:18:53.174762 IP 174.88.148.250.51117 > 159.203.18.181.50001: UDP, length 6
13:18:57.587669 IP 174.88.148.250.51117 > 159.203.18.181.50001: UDP, length 11
13:19:00.928966 IP 174.88.148.250.51117 > 159.203.18.181.50001: UDP, length 16
13:19:02.293769 IP 174.88.148.250.51117 > 159.203.18.181.50001: UDP, length 24
13:19:03.565122 IP 174.88.148.250.51117 > 159.203.18.181.50001: UDP, length 29
13:19:07.165634 IP 174.88.148.250.51117 > 159.203.18.181.50001: UDP, length 11
13:19:14.341042 IP 174.88.148.250.51117 > 159.203.18.181.50001: UDP, length 15
13:19:16.047736 IP 174.88.148.250.51117 > 159.203.18.181.50001: UDP, length 21
13:19:19.271739 IP 174.88.148.250.51117 > 159.203.18.181.50001: UDP, length 6


Source Host: 174.88.148.250
Source Port: 51117
Destination Host: 159.203.18.181
Destination Port: 50001