14:08:06.384535 IP bras-vprn-toroon474aw-lp130-03-174-88-148-250.dsl.bell.ca.55624 > lamp-ubuntu-s-1vcpu-1gb-tor1-01.ssh: Flags [.], ack 2861508, win 1026, length 0
14:08:06.384691 IP lamp-ubuntu-s-1vcpu-1gb-tor1-01.ssh > bras-vprn-toroon474aw-lp130-03-174-88-148-250.dsl.bell.ca.55624: Flags [P.], seq 2865324:2865712, ack 1909, win 501, length 388
14:08:06.385207 IP bras-vprn-toroon474aw-lp130-03-174-88-148-250.dsl.bell.ca.55624 > lamp-ubuntu-s-1vcpu-1gb-tor1-01.ssh: Flags [.], ack 2862284, win 1023, length 0
14:08:06.385252 IP lamp-ubuntu-s-1vcpu-1gb-tor1-01.ssh > bras-vprn-toroon474aw-lp130-03-174-88-148-250.dsl.bell.ca.55624: Flags [P.], seq 2865712:2865932, ack 1909, win 501, length 220
14:08:06.385680 IP bras-vprn-toroon474aw-lp130-03-174-88-148-250.dsl.bell.ca.55624 > lamp-ubuntu-s-1vcpu-1gb-tor1-01.ssh: Flags [.], ack 2862892, win 1021, length 0
14:08:06.385680 IP bras-vprn-toroon474aw-lp130-03-174-88-148-250.dsl.bell.ca.55624 > lamp-ubuntu-s-1vcpu-1gb-tor1-01.ssh: Flags [.], ack 2863500, win 1026, length 0
14:08:06.386596 IP bras-vprn-toroon474aw-lp130-03-174-88-148-250.dsl.bell.ca.55624 > lamp-ubuntu-s-1vcpu-1gb-tor1-01.ssh: Flags [.], ack 2863940, win 1024, length 0
14:08:06.386596 IP bras-vprn-toroon474aw-lp130-03-174-88-148-250.dsl.bell.ca.55624 > lamp-ubuntu-s-1vcpu-1gb-tor1-01.ssh: Flags [.], ack 2864716, win 1021, length 0
14:08:06.386905 IP lamp-ubuntu-s-1vcpu-1gb-tor1-01.ssh > bras-vprn-toroon474aw-lp130-03-174-88-148-250.dsl.bell.ca.55624: Flags [P.], seq 2865932:2866984, ack 1909, win 501, length 1052
14:08:06.386947 IP bras-vprn-toroon474aw-lp130-03-174-88-148-250.dsl.bell.ca.55624 > lamp-ubuntu-s-1vcpu-1gb-tor1-01.ssh: Flags [.], ack 2865324, win 1026, length 0
14:08:06.387158 IP lamp-ubuntu-s-1vcpu-1gb-tor1-01.ssh > bras-vprn-toroon474aw-lp130-03-174-88-148-250.dsl.bell.ca.55624: Flags [P.], seq 2866984:2867372, ack 1909, win 501, length 388
14:08:06.387388 IP lamp-ubuntu-s-1vcpu-1gb-tor1-01.ssh > bras-vprn-toroon474aw-lp130-03-174-88-148-250.dsl.bell.ca.55624: Flags [P.], seq 2867372:2867592, ack 1909, win 501, length 220
14:08:06.387737 IP bras-vprn-toroon474aw-lp130-03-174-88-148-250.dsl.bell.ca.55624 > lamp-ubuntu-s-1vcpu-1gb-tor1-01.ssh: Flags [.], ack 2865932, win 1024, length 0
14:08:06.387897 IP lamp-ubuntu-s-1vcpu-1gb-tor1-01.ssh > bras-vprn-toroon474aw-lp130-03-174-88-148-250.dsl.bell.ca.55624: Flags [P.], seq 2867592:2867812, ack 1909, win 501, length 220
14:08:06.388075 IP lamp-ubuntu-s-1vcpu-1gb-tor1-01.ssh > bras-vprn-toroon474aw-lp130-03-174-88-148-250.dsl.bell.ca.55624: Flags [P.], seq 2867812:2868016, ack 1909, win 501, length 204
14:08:06.388242 IP lamp-ubuntu-s-1vcpu-1gb-tor1-01.ssh > bras-vprn-toroon474aw-lp130-03-174-88-148-250.dsl.bell.ca.55624: Flags [P.], seq 2868016:2868236, ack 1909, win 501, length 220
14:08:06.388340 IP lamp-ubuntu-s-1vcpu-1gb-tor1-01.ssh > bras-vprn-toroon474aw-lp130-03-174-88-148-250.dsl.bell.ca.55624: Flags [P.], seq 2868236:2868676, ack 1909, win 501, length 440
14:08:06.388458 IP lamp-ubuntu-s-1vcpu-1gb-tor1-01.ssh > bras-vprn-toroon474aw-lp130-03-174-88-148-250.dsl.bell.ca.55624: Flags [P.], seq 2868676:2868896, ack 1909, win 501, length 220
14:08:06.388611 IP lamp-ubuntu-s-1vcpu-1gb-tor1-01.ssh > bras-vprn-toroon474aw-lp130-03-174-88-148-250.dsl.bell.ca.55624: Flags [P.], seq 2868896:2869116, ack 1909, win 501, length 220
14:08:06.388763 IP lamp-ubuntu-s-1vcpu-1gb-tor1-01.ssh > bras-vprn-toroon474aw-lp130-03-174-88-148-250.dsl.bell.ca.55624: Flags [P.], seq 2869116:2869336, ack 1909, win 501, length 220
14:08:06.388958 IP lamp-ubuntu-s-1vcpu-1gb-tor1-01.ssh > bras-vprn-toroon474aw-lp130-03-174-88-148-250.dsl.bell.ca.55624: Flags [P.], seq 2869336:2869556, ack 1909, win 501, length 220
14:08:06.389104 IP lamp-ubuntu-s-1vcpu-1gb-tor1-01.ssh > bras-vprn-toroon474aw-lp130-03-174-88-148-250.dsl.bell.ca.55624: Flags [P.], seq 2869556:2869776, ack 1909, win 501, length 220
14:08:06.389229 IP lamp-ubuntu-s-1vcpu-1gb-tor1-01.ssh > bras-vprn-toroon474aw-lp130-03-174-88-148-250.dsl.bell.ca.55624: Flags [P.], seq 2869776:2869996, ack 1909, win 501, length 220
14:08:06.389489 IP lamp-ubuntu-s-1vcpu-1gb-tor1-01.ssh > bras-vprn-toroon474aw-lp130-03-174-88-148-250.dsl.bell.ca.55624: Flags [P.], seq 2869996:2870216, ack 1909, win 501, length 220
14:08:06.389520 IP bras-vprn-toroon474aw-lp130-03-174-88-148-250.dsl.bell.ca.55624 > lamp-ubuntu-s-1vcpu-1gb-tor1-01.ssh: Flags [.], ack 2867372, win 1026, length 0
14:08:06.389675 IP lamp-ubuntu-s-1vcpu-1gb-tor1-01.ssh > bras-vprn-toroon474aw-lp130-03-174-88-148-250.dsl.bell.ca.55624: Flags [P.], seq 2870216:2870604, ack 1909, win 501, length 388
14:08:06.389825 IP lamp-ubuntu-s-1vcpu-1gb-tor1-01.ssh > bras-vprn-toroon474aw-lp130-03-174-88-148-250.dsl.bell.ca.55624: Flags [P.], seq 2870604:2870824, ack 1909, win 501, length 220
14:08:06.389986 IP lamp-ubuntu-s-1vcpu-1gb-tor1-01.ssh > bras-vprn-toroon474aw-lp130-03-174-88-148-250.dsl.bell.ca.55624: Flags [P.], seq 2870824:2871044, ack 1909, win 501, length 220
14:08:06.390144 IP bras-vprn-toroon474aw-lp130-03-174-88-148-250.dsl.bell.ca.55624 > lamp-ubuntu-s-1vcpu-1gb-tor1-01.ssh: Flags [.], ack 2867812, win 1024, length 0
14:08:06.390223 IP lamp-ubuntu-s-1vcpu-1gb-tor1-01.ssh > bras-vprn-toroon474aw-lp130-03-174-88-148-250.dsl.bell.ca.55624: Flags [P.], seq 2871044:2871264, ack 1909, win 501, length 220
14:08:06.390271 IP lamp-ubuntu-s-1vcpu-1gb-tor1-01.ssh > bras-vprn-toroon474aw-lp130-03-174-88-148-250.dsl.bell.ca.55624: Flags [P.], seq 2871264:2871468, ack 1909, win 501, length 204
14:08:06.390418 IP lamp-ubuntu-s-1vcpu-1gb-tor1-01.ssh > bras-vprn-toroon474aw-lp130-03-174-88-148-250.dsl.bell.ca.55624: Flags [P.], seq 2871468:2871880, ack 1909, win 501, length 412
14:08:06.390542 IP lamp-ubuntu-s-1vcpu-1gb-tor1-01.ssh > bras-vprn-toroon474aw-lp130-03-174-88-148-250.dsl.bell.ca.55624: Flags [P.], seq 2871880:2872100, ack 1909, win 501, length 220
14:08:06.390711 IP lamp-ubuntu-s-1vcpu-1gb-tor1-01.ssh > bras-vprn-toroon474aw-lp130-03-174-88-148-250.dsl.bell.ca.55624: Flags [P.], seq 2872100:2872320, ack 1909, win 501, length 220
14:08:06.390751 IP bras-vprn-toroon474aw-lp130-03-174-88-148-250.dsl.bell.ca.55624 > lamp-ubuntu-s-1vcpu-1gb-tor1-01.ssh: Flags [.], ack 2868236, win 1023, length 0
14:08:06.390751 IP bras-vprn-toroon474aw-lp130-03-174-88-148-250.dsl.bell.ca.55624 > lamp-ubuntu-s-1vcpu-1gb-tor1-01.ssh: Flags [.], ack 2868896, win 1026, length 0
14:08:06.390928 IP lamp-ubuntu-s-1vcpu-1gb-tor1-01.ssh > bras-vprn-toroon474aw-lp130-03-174-88-148-250.dsl.bell.ca.55624: Flags [P.], seq 2872320:2872876, ack 1909, win 501, length 556
14:08:06.391061 IP lamp-ubuntu-s-1vcpu-1gb-tor1-01.ssh > bras-vprn-toroon474aw-lp130-03-174-88-148-250.dsl.bell.ca.55624: Flags [P.], seq 2872876:2873096, ack 1909, win 501, length 220
14:08:06.391216 IP lamp-ubuntu-s-1vcpu-1gb-tor1-01.ssh > bras-vprn-toroon474aw-lp130-03-174-88-148-250.dsl.bell.ca.55624: Flags [P.], seq 2873096:2873316, ack 1909, win 501, length 220
14:08:06.391270 IP bras-vprn-toroon474aw-lp130-03-174-88-148-250.dsl.bell.ca.55624 > lamp-ubuntu-s-1vcpu-1gb-tor1-01.ssh: Flags [.], ack 2869336, win 1024, length 0
14:08:06.391399 IP bras-vprn-toroon474aw-lp130-03-174-88-148-250.dsl.bell.ca.55624 > lamp-ubuntu-s-1vcpu-1gb-tor1-01.ssh: Flags [.], ack 2869776, win 1023, length 0
14:08:06.391436 IP lamp-ubuntu-s-1vcpu-1gb-tor1-01.ssh > bras-vprn-toroon474aw-lp130-03-174-88-148-250.dsl.bell.ca.55624: Flags [P.], seq 2873316:2873704, ack 1909, win 501, length 388
14:08:06.391633 IP lamp-ubuntu-s-1vcpu-1gb-tor1-01.ssh > bras-vprn-toroon474aw-lp130-03-174-88-148-250.dsl.bell.ca.55624: Flags [P.], seq 2873704:2874092, ack 1909, win 501, length 388
14:08:06.391674 IP bras-vprn-toroon474aw-lp130-03-174-88-148-250.dsl.bell.ca.55624 > lamp-ubuntu-s-1vcpu-1gb-tor1-01.ssh: Flags [.], ack 2870216, win 1021, length 0
14:08:06.391839 IP lamp-ubuntu-s-1vcpu-1gb-tor1-01.ssh > bras-vprn-toroon474aw-lp130-03-174-88-148-250.dsl.bell.ca.55624: Flags [P.], seq 2874092:2874480, ack 1909, win 501, length 388
14:08:06.391935 IP lamp-ubuntu-s-1vcpu-1gb-tor1-01.ssh > bras-vprn-toroon474aw-lp130-03-174-88-148-250.dsl.bell.ca.55624: Flags [P.], seq 2874480:2874700, ack 1909, win 501, length 220
14:08:06.392026 IP bras-vprn-toroon474aw-lp130-03-174-88-148-250.dsl.bell.ca.55624 > lamp-ubuntu-s-1vcpu-1gb-tor1-01.ssh: Flags [.], ack 2870824, win 1026, length 0
14:08:06.392090 IP lamp-ubuntu-s-1vcpu-1gb-tor1-01.ssh > bras-vprn-toroon474aw-lp130-03-174-88-148-250.dsl.bell.ca.55624: Flags [P.], seq 2874700:2874920, ack 1909, win 501, length 220
14:08:06.392205 IP lamp-ubuntu-s-1vcpu-1gb-tor1-01.ssh > bras-vprn-toroon474aw-lp130-03-174-88-148-250.dsl.bell.ca.55624: Flags [P.], seq 2874920:2875308, ack 1909, win 501, length 388
14:08:06.398081 IP bras-vprn-toroon474aw-lp130-03-174-88-148-250.dsl.bell.ca.55624 > lamp-ubuntu-s-1vcpu-1gb-tor1-01.ssh: Flags [.], ack 2871264, win 1024, length 0
14:08:06.398081 IP bras-vprn-toroon474aw-lp130-03-174-88-148-250.dsl.bell.ca.55624 > lamp-ubuntu-s-1vcpu-1gb-tor1-01.ssh: Flags [.], ack 2871880, win 1022, length 0
14:08:06.398081 IP bras-vprn-toroon474aw-lp130-03-174-88-148-250.dsl.bell.ca.55624 > lamp-ubuntu-s-1vcpu-1gb-tor1-01.ssh: Flags [.], ack 2872320, win 1026, length 0
14:08:06.398081 IP bras-vprn-toroon474aw-lp130-03-174-88-148-250.dsl.bell.ca.55624 > lamp-ubuntu-s-1vcpu-1gb-tor1-01.ssh: Flags [.], ack 2873316, win 1022, length 0
14:08:06.398081 IP bras-vprn-toroon474aw-lp130-03-174-88-148-250.dsl.bell.ca.55624 > lamp-ubuntu-s-1vcpu-1gb-tor1-01.ssh: Flags [.], ack 2873704, win 1021, length 0
14:08:06.398082 IP bras-vprn-toroon474aw-lp130-03-174-88-148-250.dsl.bell.ca.55624 > lamp-ubuntu-s-1vcpu-1gb-tor1-01.ssh: Flags [P.], seq 1909:1945, ack 2873704, win 1021, length 36
14:08:06.398082 IP bras-vprn-toroon474aw-lp130-03-174-88-148-250.dsl.bell.ca.55624 > lamp-ubuntu-s-1vcpu-1gb-tor1-01.ssh: Flags [.], ack 2874092, win 1026, length 0
14:08:06.398082 IP bras-vprn-toroon474aw-lp130-03-174-88-148-250.dsl.bell.ca.55624 > lamp-ubuntu-s-1vcpu-1gb-tor1-01.ssh: Flags [.], ack 2874700, win 1024, length 0
14:08:06.398167 IP lamp-ubuntu-s-1vcpu-1gb-tor1-01.ssh > bras-vprn-toroon474aw-lp130-03-174-88-148-250.dsl.bell.ca.55624: Flags [P.], seq 2875308:2875528, ack 1909, win 501, length 220
